{
  "schema": "cdeadmin.ui-capabilities.v1",
  "engine": "postgresql",
  "profiles": [
    "postgresql-native"
  ],
  "beta_tier": "full",
  "version_range": {
    "minimum": "13.0",
    "tested": [
      "18.3"
    ]
  },
  "kinds": [
    {
      "resource_kind": "table",
      "family": "table",
      "form": "forms/table.form.json",
      "operations": [
        {
          "operation_id": "create",
          "tier": 1
        },
        {
          "operation_id": "alter",
          "tier": 1
        },
        {
          "operation_id": "insert",
          "tier": 1
        },
        {
          "operation_id": "update",
          "tier": 1
        },
        {
          "operation_id": "delete",
          "tier": 1
        },
        {
          "operation_id": "drop",
          "tier": 1
        }
      ]
    },
    {
      "resource_kind": "partition",
      "family": "table",
      "variant": "partition",
      "form": "forms/table.form.json",
      "operations": [
        {
          "operation_id": "create",
          "tier": 1
        },
        {
          "operation_id": "alter",
          "tier": 1
        },
        {
          "operation_id": "drop",
          "tier": 1
        }
      ]
    },
    {
      "resource_kind": "foreign-table",
      "family": "table",
      "variant": "foreign",
      "form": "forms/table.form.json",
      "operations": [
        {
          "operation_id": "create",
          "tier": 1
        },
        {
          "operation_id": "alter",
          "tier": 1
        },
        {
          "operation_id": "drop",
          "tier": 1
        }
      ]
    },
    {
      "resource_kind": "view",
      "family": "view",
      "form": "forms/view.form.json",
      "operations": [
        {
          "operation_id": "create",
          "tier": 1
        },
        {
          "operation_id": "alter",
          "tier": 1
        },
        {
          "operation_id": "drop",
          "tier": 1
        }
      ]
    },
    {
      "resource_kind": "materialized-view",
      "family": "view",
      "variant": "materialized",
      "form": "forms/view.form.json",
      "operations": [
        {
          "operation_id": "create",
          "tier": 1
        },
        {
          "operation_id": "alter",
          "tier": 1
        },
        {
          "operation_id": "drop",
          "tier": 1
        },
        {
          "operation_id": "refresh",
          "tier": 1
        }
      ]
    },
    {
      "resource_kind": "index",
      "family": "index",
      "form": "forms/index.form.json",
      "operations": [
        {
          "operation_id": "create",
          "tier": 1
        },
        {
          "operation_id": "alter",
          "tier": 1
        },
        {
          "operation_id": "drop",
          "tier": 1
        }
      ]
    },
    {
      "resource_kind": "function",
      "family": "routine",
      "variant": "function",
      "form": "forms/routine.form.json",
      "operations": [
        {
          "operation_id": "create",
          "tier": 1
        },
        {
          "operation_id": "alter",
          "tier": 1
        },
        {
          "operation_id": "drop",
          "tier": 1
        }
      ]
    },
    {
      "resource_kind": "procedure",
      "family": "routine",
      "variant": "procedure",
      "form": "forms/routine.form.json",
      "operations": [
        {
          "operation_id": "create",
          "tier": 1
        },
        {
          "operation_id": "alter",
          "tier": 1
        },
        {
          "operation_id": "drop",
          "tier": 1
        }
      ]
    },
    {
      "resource_kind": "aggregate",
      "family": "routine",
      "variant": "aggregate",
      "form": "forms/routine.form.json",
      "operations": [
        {
          "operation_id": "create",
          "tier": 1
        },
        {
          "operation_id": "alter",
          "tier": 1
        },
        {
          "operation_id": "drop",
          "tier": 1
        }
      ]
    },
    {
      "resource_kind": "trigger",
      "family": "trigger",
      "form": "forms/trigger.form.json",
      "operations": [
        {
          "operation_id": "create",
          "tier": 1
        },
        {
          "operation_id": "alter",
          "tier": 1
        },
        {
          "operation_id": "drop",
          "tier": 1
        }
      ]
    },
    {
      "resource_kind": "event-trigger",
      "family": "trigger",
      "variant": "event",
      "form": "forms/trigger.form.json",
      "operations": [
        {
          "operation_id": "create",
          "tier": 1
        },
        {
          "operation_id": "alter",
          "tier": 1
        },
        {
          "operation_id": "drop",
          "tier": 1
        }
      ]
    },
    {
      "resource_kind": "rule",
      "family": "engine_object",
      "operations": [
        {
          "operation_id": "create",
          "tier": 1
        },
        {
          "operation_id": "alter",
          "tier": 1
        },
        {
          "operation_id": "drop",
          "tier": 1
        }
      ]
    },
    {
      "resource_kind": "sequence",
      "family": "sequence",
      "form": "forms/sequence.form.json",
      "operations": [
        {
          "operation_id": "create",
          "tier": 1
        },
        {
          "operation_id": "alter",
          "tier": 1
        },
        {
          "operation_id": "drop",
          "tier": 1
        }
      ]
    },
    {
      "resource_kind": "domain",
      "family": "type",
      "variant": "domain",
      "form": "forms/type.form.json",
      "operations": [
        {
          "operation_id": "create",
          "tier": 1
        },
        {
          "operation_id": "alter",
          "tier": 1
        },
        {
          "operation_id": "drop",
          "tier": 1
        }
      ]
    },
    {
      "resource_kind": "type",
      "family": "type",
      "form": "forms/type.form.json",
      "operations": [
        {
          "operation_id": "create",
          "tier": 1
        },
        {
          "operation_id": "alter",
          "tier": 1
        },
        {
          "operation_id": "drop",
          "tier": 1
        }
      ]
    },
    {
      "resource_kind": "role",
      "family": "role",
      "form": "forms/role.form.json",
      "operations": [
        {
          "operation_id": "create",
          "tier": 1
        },
        {
          "operation_id": "alter",
          "tier": 1
        },
        {
          "operation_id": "drop",
          "tier": 1
        }
      ]
    },
    {
      "resource_kind": "privilege",
      "family": "role",
      "variant": "grant",
      "form": "forms/role.form.json",
      "operations": [
        {
          "operation_id": "grant",
          "tier": 1
        },
        {
          "operation_id": "revoke",
          "tier": 1
        }
      ]
    },
    {
      "resource_kind": "row-policy",
      "family": "engine_object",
      "operations": [
        {
          "operation_id": "create",
          "tier": 1
        },
        {
          "operation_id": "alter",
          "tier": 1
        },
        {
          "operation_id": "drop",
          "tier": 1
        }
      ]
    },
    {
      "resource_kind": "database",
      "family": "database",
      "form": "forms/database.form.json",
      "operations": [
        {
          "operation_id": "create",
          "tier": 1
        },
        {
          "operation_id": "alter",
          "tier": 1
        },
        {
          "operation_id": "drop",
          "tier": 1
        }
      ]
    },
    {
      "resource_kind": "schema",
      "family": "engine_object",
      "operations": [
        {
          "operation_id": "create",
          "tier": 1
        },
        {
          "operation_id": "alter",
          "tier": 1
        },
        {
          "operation_id": "drop",
          "tier": 1
        }
      ]
    },
    {
      "resource_kind": "tablespace",
      "family": "engine_object",
      "operations": [
        {
          "operation_id": "create",
          "tier": 1
        },
        {
          "operation_id": "alter",
          "tier": 1
        },
        {
          "operation_id": "drop",
          "tier": 1
        }
      ]
    },
    {
      "resource_kind": "extension",
      "family": "engine_object",
      "operations": [
        {
          "operation_id": "create",
          "tier": 1
        },
        {
          "operation_id": "alter",
          "tier": 1
        },
        {
          "operation_id": "drop",
          "tier": 1
        }
      ]
    },
    {
      "resource_kind": "server",
      "family": "server",
      "form": "forms/server.form.json",
      "operations": [
        {
          "operation_id": "create",
          "tier": 1
        },
        {
          "operation_id": "alter",
          "tier": 1
        },
        {
          "operation_id": "drop",
          "tier": 1
        }
      ]
    }
  ]
}
