{
  "schema": "cdeadmin.ui-capabilities.v1",
  "engine": "sqlite",
  "profiles": [
    "sqlite-native"
  ],
  "beta_tier": "full",
  "version_range": {
    "minimum": "3.35.0",
    "tested": [
      "3.53.0"
    ]
  },
  "kinds": [
    {
      "resource_kind": "table",
      "family": "table",
      "form": "forms/table.form.json",
      "operations": [
        {
          "operation_id": "inspect",
          "tier": 1,
          "mutation_class": "read"
        },
        {
          "operation_id": "create",
          "tier": 1,
          "mutation_class": "write"
        },
        {
          "operation_id": "alter",
          "tier": 1,
          "mutation_class": "write"
        },
        {
          "operation_id": "rename",
          "tier": 1,
          "mutation_class": "write"
        },
        {
          "operation_id": "insert",
          "tier": 1,
          "mutation_class": "write"
        },
        {
          "operation_id": "update",
          "tier": 1,
          "mutation_class": "write"
        },
        {
          "operation_id": "delete",
          "tier": 1,
          "mutation_class": "destructive"
        },
        {
          "operation_id": "drop",
          "tier": 1,
          "mutation_class": "destructive"
        }
      ]
    },
    {
      "resource_kind": "virtual-table",
      "family": "table",
      "variant": "virtual",
      "form": "forms/table.form.json",
      "operations": [
        {
          "operation_id": "inspect",
          "tier": 1,
          "mutation_class": "read"
        },
        {
          "operation_id": "create",
          "tier": 1,
          "mutation_class": "write"
        },
        {
          "operation_id": "rename",
          "tier": 1,
          "mutation_class": "write"
        },
        {
          "operation_id": "drop",
          "tier": 1,
          "mutation_class": "destructive"
        }
      ]
    },
    {
      "resource_kind": "fts-table",
      "family": "table",
      "variant": "fts",
      "form": "forms/table.form.json",
      "operations": [
        {
          "operation_id": "inspect",
          "tier": 1,
          "mutation_class": "read"
        },
        {
          "operation_id": "create",
          "tier": 1,
          "mutation_class": "write"
        },
        {
          "operation_id": "rename",
          "tier": 1,
          "mutation_class": "write"
        },
        {
          "operation_id": "drop",
          "tier": 1,
          "mutation_class": "destructive"
        }
      ]
    },
    {
      "resource_kind": "view",
      "family": "view",
      "form": "forms/view.form.json",
      "operations": [
        {
          "operation_id": "inspect",
          "tier": 1,
          "mutation_class": "read"
        },
        {
          "operation_id": "create",
          "tier": 1,
          "mutation_class": "write"
        },
        {
          "operation_id": "drop",
          "tier": 1,
          "mutation_class": "destructive"
        }
      ]
    },
    {
      "resource_kind": "index",
      "family": "index",
      "form": "forms/index.form.json",
      "operations": [
        {
          "operation_id": "inspect",
          "tier": 1,
          "mutation_class": "read"
        },
        {
          "operation_id": "create",
          "tier": 1,
          "mutation_class": "write"
        },
        {
          "operation_id": "drop",
          "tier": 1,
          "mutation_class": "destructive"
        }
      ]
    },
    {
      "resource_kind": "trigger",
      "family": "trigger",
      "form": "forms/trigger.form.json",
      "operations": [
        {
          "operation_id": "inspect",
          "tier": 1,
          "mutation_class": "read"
        },
        {
          "operation_id": "create",
          "tier": 1,
          "mutation_class": "write"
        },
        {
          "operation_id": "drop",
          "tier": 1,
          "mutation_class": "destructive"
        }
      ]
    },
    {
      "resource_kind": "database",
      "family": "database",
      "form": "forms/database.form.json",
      "operations": [
        {
          "operation_id": "inspect",
          "tier": 1,
          "mutation_class": "read"
        },
        {
          "operation_id": "create",
          "tier": 1,
          "mutation_class": "admin"
        },
        {
          "operation_id": "alter",
          "tier": 1,
          "mutation_class": "admin"
        },
        {
          "operation_id": "drop",
          "tier": 1,
          "mutation_class": "destructive"
        }
      ]
    },
    {
      "resource_kind": "attached-database",
      "family": "database",
      "variant": "attached",
      "form": "forms/database.form.json",
      "operations": [
        {
          "operation_id": "inspect",
          "tier": 1,
          "mutation_class": "read"
        }
      ]
    },
    {
      "resource_kind": "pragma",
      "family": "engine_object",
      "operations": [
        {
          "operation_id": "inspect",
          "tier": 1,
          "mutation_class": "read"
        }
      ]
    },
    {
      "resource_kind": "extension",
      "family": "engine_object",
      "operations": [
        {
          "operation_id": "inspect",
          "tier": 1,
          "mutation_class": "read"
        }
      ]
    },
    {
      "resource_kind": "server",
      "family": "server",
      "form": "forms/server.form.json",
      "operations": [
        {
          "operation_id": "create",
          "tier": 1
        },
        {
          "operation_id": "alter",
          "tier": 1
        },
        {
          "operation_id": "drop",
          "tier": 1
        }
      ]
    },
    {
      "resource_kind": "column",
      "family": "engine_object",
      "title": "Column",
      "operations": [
        {
          "operation_id": "inspect",
          "tier": 1,
          "mutation_class": "read"
        },
        {
          "operation_id": "create",
          "tier": 1,
          "mutation_class": "write"
        },
        {
          "operation_id": "rename",
          "tier": 1,
          "mutation_class": "write"
        },
        {
          "operation_id": "drop",
          "tier": 1,
          "mutation_class": "destructive"
        }
      ]
    },
    {
      "resource_kind": "constraint",
      "family": "engine_object",
      "title": "Constraint",
      "operations": [
        {
          "operation_id": "inspect",
          "tier": 1,
          "mutation_class": "read"
        }
      ]
    }
  ]
}
