{
  "schema": "cdeadmin.ui-capabilities.v1",
  "engine": "tidb",
  "profiles": [
    "tidb-native"
  ],
  "beta_tier": "full",
  "version_range": {
    "minimum": "8.5.6",
    "tested": [
      "8.5.6"
    ]
  },
  "kinds": [
    {
      "resource_kind": "cluster",
      "family": "engine_object",
      "title": "TiDB cluster",
      "operations": [
        {
          "operation_id": "inspect",
          "tier": 1,
          "mutation_class": "read"
        }
      ]
    },
    {
      "resource_kind": "node",
      "family": "engine_object",
      "title": "Node",
      "operations": [
        {
          "operation_id": "inspect",
          "tier": 1,
          "mutation_class": "read"
        }
      ]
    },
    {
      "resource_kind": "database",
      "family": "database",
      "form": "forms/database.form.json",
      "operations": [
        {
          "operation_id": "inspect",
          "tier": 1,
          "mutation_class": "read"
        },
        {
          "operation_id": "create",
          "tier": 1,
          "mutation_class": "admin"
        },
        {
          "operation_id": "alter",
          "tier": 1,
          "mutation_class": "admin"
        },
        {
          "operation_id": "drop",
          "tier": 1,
          "mutation_class": "destructive"
        }
      ]
    },
    {
      "resource_kind": "table",
      "family": "table",
      "form": "forms/table.form.json",
      "operations": [
        {
          "operation_id": "inspect",
          "tier": 1,
          "mutation_class": "read"
        },
        {
          "operation_id": "create",
          "tier": 1,
          "mutation_class": "write"
        },
        {
          "operation_id": "alter",
          "tier": 1,
          "mutation_class": "write"
        },
        {
          "operation_id": "rename",
          "tier": 1,
          "mutation_class": "write"
        },
        {
          "operation_id": "insert",
          "tier": 1,
          "mutation_class": "write"
        },
        {
          "operation_id": "update",
          "tier": 1,
          "mutation_class": "write"
        },
        {
          "operation_id": "delete",
          "tier": 1,
          "mutation_class": "destructive"
        },
        {
          "operation_id": "drop",
          "tier": 1,
          "mutation_class": "destructive"
        }
      ]
    },
    {
      "resource_kind": "column",
      "family": "engine_object",
      "title": "Column",
      "operations": [
        {
          "operation_id": "inspect",
          "tier": 1,
          "mutation_class": "read"
        },
        {
          "operation_id": "create",
          "tier": 1,
          "mutation_class": "write"
        },
        {
          "operation_id": "alter",
          "tier": 1,
          "mutation_class": "write"
        },
        {
          "operation_id": "rename",
          "tier": 1,
          "mutation_class": "write"
        },
        {
          "operation_id": "drop",
          "tier": 1,
          "mutation_class": "destructive"
        }
      ]
    },
    {
      "resource_kind": "index",
      "family": "index",
      "form": "forms/index.form.json",
      "operations": [
        {
          "operation_id": "inspect",
          "tier": 1,
          "mutation_class": "read"
        },
        {
          "operation_id": "create",
          "tier": 1,
          "mutation_class": "write"
        },
        {
          "operation_id": "drop",
          "tier": 1,
          "mutation_class": "destructive"
        }
      ]
    },
    {
      "resource_kind": "constraint",
      "family": "engine_object",
      "title": "Constraint",
      "operations": [
        {
          "operation_id": "inspect",
          "tier": 1,
          "mutation_class": "read"
        },
        {
          "operation_id": "create",
          "tier": 1,
          "mutation_class": "write"
        },
        {
          "operation_id": "drop",
          "tier": 1,
          "mutation_class": "destructive"
        }
      ]
    },
    {
      "resource_kind": "view",
      "family": "view",
      "form": "forms/view.form.json",
      "operations": [
        {
          "operation_id": "inspect",
          "tier": 1,
          "mutation_class": "read"
        },
        {
          "operation_id": "create",
          "tier": 1,
          "mutation_class": "write"
        },
        {
          "operation_id": "alter",
          "tier": 1,
          "mutation_class": "write"
        },
        {
          "operation_id": "drop",
          "tier": 1,
          "mutation_class": "destructive"
        }
      ]
    },
    {
      "resource_kind": "sequence",
      "family": "sequence",
      "form": "forms/sequence.form.json",
      "operations": [
        {
          "operation_id": "inspect",
          "tier": 1,
          "mutation_class": "read"
        },
        {
          "operation_id": "create",
          "tier": 1,
          "mutation_class": "write"
        },
        {
          "operation_id": "alter",
          "tier": 1,
          "mutation_class": "write"
        },
        {
          "operation_id": "drop",
          "tier": 1,
          "mutation_class": "destructive"
        }
      ]
    },
    {
      "resource_kind": "partition",
      "family": "engine_object",
      "title": "Partition",
      "operations": [
        {
          "operation_id": "inspect",
          "tier": 1,
          "mutation_class": "read"
        }
      ]
    },
    {
      "resource_kind": "placement-policy",
      "family": "engine_object",
      "title": "Placement policy",
      "operations": [
        {
          "operation_id": "inspect",
          "tier": 1,
          "mutation_class": "read"
        },
        {
          "operation_id": "alter",
          "tier": 1,
          "mutation_class": "admin"
        },
        {
          "operation_id": "create",
          "tier": 1,
          "mutation_class": "admin"
        },
        {
          "operation_id": "drop",
          "tier": 1,
          "mutation_class": "destructive"
        }
      ]
    },
    {
      "resource_kind": "resource-group",
      "family": "engine_object",
      "title": "Resource group",
      "operations": [
        {
          "operation_id": "inspect",
          "tier": 1,
          "mutation_class": "read"
        },
        {
          "operation_id": "alter",
          "tier": 1,
          "mutation_class": "admin"
        },
        {
          "operation_id": "create",
          "tier": 1,
          "mutation_class": "admin"
        },
        {
          "operation_id": "drop",
          "tier": 1,
          "mutation_class": "destructive"
        }
      ]
    },
    {
      "resource_kind": "tiflash-replica",
      "family": "engine_object",
      "title": "TiFlash replica",
      "operations": [
        {
          "operation_id": "inspect",
          "tier": 1,
          "mutation_class": "read"
        }
      ]
    },
    {
      "resource_kind": "job",
      "family": "engine_object",
      "title": "DDL job",
      "operations": [
        {
          "operation_id": "inspect",
          "tier": 1,
          "mutation_class": "read"
        }
      ]
    },
    {
      "resource_kind": "changefeed",
      "family": "engine_object",
      "title": "TiCDC changefeed",
      "operations": [
        {
          "operation_id": "inspect",
          "tier": 1,
          "mutation_class": "read"
        },
        {
          "operation_id": "create",
          "tier": 1,
          "mutation_class": "admin"
        },
        {
          "operation_id": "remove",
          "tier": 1,
          "mutation_class": "destructive"
        }
      ]
    },
    {
      "resource_kind": "backup",
      "family": "engine_object",
      "title": "Backup",
      "operations": [
        {
          "operation_id": "inspect",
          "tier": 1,
          "mutation_class": "read"
        }
      ]
    },
    {
      "resource_kind": "user",
      "family": "role",
      "variant": "user",
      "form": "forms/role.form.json",
      "operations": [
        {
          "operation_id": "inspect",
          "tier": 1,
          "mutation_class": "read"
        },
        {
          "operation_id": "create",
          "tier": 1,
          "mutation_class": "admin"
        },
        {
          "operation_id": "alter",
          "tier": 1,
          "mutation_class": "admin"
        },
        {
          "operation_id": "drop",
          "tier": 1,
          "mutation_class": "destructive"
        }
      ]
    },
    {
      "resource_kind": "role",
      "family": "role",
      "variant": "role",
      "form": "forms/role.form.json",
      "operations": [
        {
          "operation_id": "inspect",
          "tier": 1,
          "mutation_class": "read"
        },
        {
          "operation_id": "create",
          "tier": 1,
          "mutation_class": "admin"
        },
        {
          "operation_id": "drop",
          "tier": 1,
          "mutation_class": "destructive"
        }
      ]
    },
    {
      "resource_kind": "privilege",
      "family": "role",
      "variant": "grant",
      "form": "forms/role.form.json",
      "operations": [
        {
          "operation_id": "inspect",
          "tier": 1,
          "mutation_class": "read"
        },
        {
          "operation_id": "grant",
          "tier": 1,
          "mutation_class": "admin"
        },
        {
          "operation_id": "revoke",
          "tier": 1,
          "mutation_class": "admin"
        }
      ]
    }
  ]
}
